Game_Title,Consoles,ESRB_Rating,Content_Descriptors,Interactive_Elements,Content_Summary
Tengoku Struggle -Strayside-,Nintendo Switch,T,"Alcohol and Tobacco Reference,Blood,Fantasy Violence,Language,Sexual Themes",No Interactive Elements,"This is a visual novel in which players assume the role of a Hell Guardian trying to capture Hell''s escaped prisoners. A handful of still-screen images can depict violence and blood: a character slashing men off-screen, with screaming sounds; a character burning to death; a character with blood-splattered clothing/face; blood splashes on the screen. The game contains sexual references in the dialogue (e.g., “That night, I was defiled by many other monks, right in front of him”; “…[T]o give a woman honor means to drag them into their bed”; “We went and had so much sex right away”; “Take off your panties, then put your hands against the wall.”). Dialogue also references alcohol (e.g., being drunk/wasted; wine, sake, booze), as well as tobacco (e.g., ""He took out a cigarette and savored a puff.""). The words “sh*t” and “a*shole” appear in the game."
Teenage Mutant Ninja Turtles Arcade: Wrath of the Mutants,"Windows PC, PlayStation 4, PlayStation 5, Nintendo Switch, Xbox One, Xbox Series",E10+,Fantasy Violence,No Interactive Elements,"This is an action game in which players control Teenage Mutant Ninja Turtles through levels of enemies. As players attempt to foil Shredder''s evil plans, they use various weapons (katanas, staffs, nunchuks) to defeat cartoony enemies (e.g., soldiers, droids, mutant creatures) in beat-em-up-style fighting. Characters can also use special attacks (e.g., tornadoes, fiery blasts, electric surges) to inflict wider damage. Some enemies can shoot stylized lasers, flames, or energy bursts at players'' character."
Toaplan Arcade Garage: Kyukyoku Tiger-Heli,"PlayStation 4, Nintendo Switch",E10+,Fantasy Violence,No Interactive Elements,"This is a collection of ten arcade-style action games in which players control helicopters and robots through levels of enemies. Most games allow players to control helicopters that shoot projectiles at enemies (e.g., planes, tanks, drones); games are presented from a top-down, scrolling perspective, highlighted by explosions and gunfire. One side-scrolling game allows players to control a robot soldier that punches and uses laser fire to attack enemies; the beat-''em-gameplay depicts depleting health bars, various attacks (e.g., Speed Punch, Fire Punch, Super Punch), and protracted boss battles."
Ugly,Nintendo Switch,T,"Blood,Fantasy Violence,Mild Language,Sexual Themes,Use of Alcohol",No Interactive Elements,"This is a puzzle platformer in which players assume the role of a prince battling his inner demons while reflecting on a life of abuse and cruelty. From a 2D side-scrolling perspective, players explore a fantastical mansion while searching for keys, solving puzzles, and unlocking memories. Boss characters sometimes attempt to crush players and/or menace them with fire. Some areas depict small corpses, bloodstained walls, and torture devices. One sequence briefly depicts a character with shards of glass embedded in its face, with blood dripping from wounds. One level depicts a dungeon with sexual and BDSM paraphernalia: a sex swing hanging from the ceiling; sex toys on bookshelves; bondage tools in the corner. A central gameplay mechanic involves players'' character resetting the puzzle by drinking a bottle of alcohol, as a hazy, blurry effect appears each time. The word “bastard” appears in the game."
Double Dragon Collection,Nintendo Switch,E10+,"Language,Mild Blood,Mild Violence",No Interactive Elements,"This is a collection of arcade-style action-fighting games in which players assume the roles of brothers on a rescue mission. From a side-scrolling perspective, players traverse 2D environments to battle human enemies in “beat-''em-up”-style combat. Players defeat enemies by using melee attacks and small weapons (e.g., knives, whips, bats). In one game, pixelated blood-splatter effects occur when enemies are struck by knives; still-images can depict boss characters with small steaks of blood. The word “bastard” appears in the game."
Outward Definitive Edition,Nintendo Switch,M,"Blood and Gore,Partial Nudity,Violence",Users Interact (Switch),"This is a role-playing game in which players assume the role of a fighter involved in a war between three factions. From a third-person perspective, players explore caves and towns, perform quests, and battle various enemies (e.g., wolves, ghouls, skeletons, humans). Characters use swords, clubs, and magic attacks (e.g., blasts of fire and ice) to kill enemies in melee combat. Successful hits are accompanied by splashes of blood, and several environments depict corpses and/or large bloodstains. Some areas contain dismembered or mutilated corpses; several of these corpses are depicted with exposed breasts and/or buttocks."
Cupid Parasite: Sweet and Spicy Darling,Nintendo Switch,T,"Fantasy Violence,Language,Mild Blood,Sexual Themes,Use of Alcohol and Tobacco",No Interactive Elements,"This is a visual novel in which players follow the story of Lynette Mirror and her experiences with romantic relationships. Players can follow several storylines while making choices that affect the course of their relationships. Some choices lead to depictions of violence: a female demon impaled by magical arrows; a character spitting out blood after being impaled (off screen). Other choices lead to sequences containing sexual material, largely conveyed through text/dialogue (e.g., “He slipped a finger into my mouth…He traced his tongue along the nape of my neck”: ""I felt the zipper of my skirt being undone""; “His rough tongue glided over my body as he nibbled on me.”). One sequence references a character''s husband''s lack of virility (e.g., “It was so…soft and deflated”; “Clearly [he] had been searching for a solution…a solution on how to get it up again.”). The game depicts prolonged sequences of social drinking, resulting in characters getting drunk, with slurred speech (e.g., “Before I knew it, everyone was wasted”; “Everyone else continued to chug alcohol.""). Another sequence references a drunk character being taking advantage of (e.g., “In my inebriated state, I couldn''t stand up properly...He seized this vulnerable moment when my yearnings for companionship overpowered me.”). In one sequence, a demon can be seen holding a smoking pipe. The word “bullsh*t” appears in the game."
The Plucky Squire,"PlayStation 5, Nintendo Switch, Xbox Series",E10+,Fantasy Violence,No Interactive Elements,"This is an action-adventure game in which players follow the story of a squire who explores 2D and 3D realms while trying to save his friends. Players traverse platform environments, solve puzzles, and fight whimsical enemies (e.g., goblins, birds, badgers). Players use a small sword to strike cartoony enemies that disappear into puffs of smoke when defeated. One mini-game depicts an exaggerated boxing match, with characters punching and dodging to defeat each other; action is highlighted by impact sounds, brief cries of pain, and screen-shaking effects."
Chicory: A Colorful Tale,"PlayStation 4, PlayStation 5, Nintendo Switch",E10+,"Comic Mischief,Mild Fantasy Violence,Mild Suggestive Themes",No Interactive Elements,No Rating Summary
Truck & Logistics Simulator,"PlayStation 5, Nintendo Switch",E,No Descriptors,"Users Interact (Switch,PlayStation 5)",No Rating Summary
The Stanley Parable: Ultra Deluxe,"Linux, Macintosh, Windows PC, PlayStation 4, PlayStation 5, Nintendo Switch",T,"Drug Reference,Mild Blood,Mild Language,Mild Suggestive Themes,Mild Violence",No Interactive Elements,No Rating Summary
Lost Ruins,"PlayStation 4, PlayStation 5, Nintendo Switch",T,"Blood and Gore,Suggestive Themes,Violence",No Interactive Elements,No Rating Summary
Lawn Mowing Simulator - Landmark Edition,Nintendo Switch,E,No Descriptors,No Interactive Elements,This is a simulation game in which players can cut grass and weeds using ride-on lawn mowers and handheld trimmers. Players can start a lawn care business and perform jobs on residential gardens and other landscapes/sites.
