Game_Title,Consoles,ESRB_Rating,Content_Descriptors,Interactive_Elements,Content_Summary
The Smurfs - Dreams,"PlayStation 5, Nintendo Switch",E,Mild Fantasy Violence,No Interactive Elements,"This is a 3D platformer game in which players enter dream worlds to free Smurfs struck by a sleeping curse. From an overhead perspective, players explore Smurfs'' dreams, traverse platforms, and occasionally defeat enemy creatures. Players can jump on enemies'' heads, throw fruit at them, and use an oversized hammer to attack enemies. Boss battles involve more protracted combat, as players toss objects to deplete boss characters'' health bars."
Touhou Luna Nights,"PlayStation 5, Nintendo Switch, Xbox Series",E10+,"Fantasy Violence,Mild Blood,Mild Language",No Interactive Elements,No Rating Summary
Glover (QUByte Classics),"PlayStation 5, Nintendo Switch",E,Mild Fantasy Violence,No Interactive Elements,"This is an adventure game in which players control a wizard''s magical glove as it searches for crystals to restore peace to a kingdom. Players traverse platform environments while collecting items, solving puzzles, and dispatching enemies. The players'' glove can pounce on enemies, throw objects at them, or trigger mechanisms for cartoony attacks (e.g., a giant boxing glove; oversized bombs). Characters typically react to damage by falling back or turning into a puff of stars."
Gigantosaurus: Dino Sports,"Windows PC, PlayStation 4, PlayStation 5, Nintendo Switch, Xbox One, Xbox Series",E,Mild Fantasy Violence,No Interactive Elements,"This is a party game in which players control dinosaurs competing in sports-themed mini-games. A handful of mini-games depict mild instances of violence: players hit by falling rocks while climbing; players shooting fruit into the mouths of plants, accompanied by a targeting reticule (i.e., crosshairs); players hit by fruit, briefly staining the screen."
The House Of The Dead 2: Remake,Nintendo Switch,M,"Blood and Gore,Violence",No Interactive Elements,"This is a rail shooter light gun game in which players assume the role of an agent in search of a missing colleague in Venice, Italy. From a first-person perspective, navigate through the city while using pistols to shoot and kill zombies and mutant creatures. Killing creatures often results in decapitation and/or dismemberment, with large blood-splatter effects. Combat is often fast paced, accompanied by gunfire, screams of pain, and large explosions. A handful of sequences depict civilians attacked and killed by enemy creatures."
Cat Quest II,Nintendo Switch,E10+,Fantasy Violence,No Interactive Elements,No Rating Summary
Cat Quest,Nintendo Switch,E10+,Fantasy Violence,No Interactive Elements,No Rating Summary
Death Trick: Double Blind,Nintendo Switch,M,"Mild Blood,Mild Violence,Strong Language",No Interactive Elements,"This is a visual novel/adventure game in which players assume the role of a detective investigating a murder in a circus. Players can study the crime scene, collect evidence, and interact with various characters and witnesses. A still-image of the crime scene depicts a corpse, with bloodstained clothing and a weapon protruding from their torso. Other still-images depict instances of violence and/or mild blood: a character beaten up, resulting in a bloody nose; a character stabbed with scissors; zoomed in depictions of the crime scene. The word “f**k” appears in the game."
Koumajou Remilia Ⅱ: Stranger''s Requiem,Nintendo Switch,T,"Blood,Fantasy Violence,Mild Suggestive Themes,Use of Alcohol",No Interactive Elements,No Rating Summary
Fitness Boxing feat. HATSUNE MIKU,Nintendo Switch,E,No Descriptors,No Interactive Elements,"This is a fitness/rhythm-based game in which players perform boxing routines by following timed prompts along with music. Players earn points by matching Hatsune Miku and her friends'' various on -screen movements (e.g., jabs, uppercuts, dodges)."
Hubris,PlayStation 5,T,"Animated Blood,Violence",No Interactive Elements,"This is a first-person shooter in which players assume the role of a new recruit searching an alien planet for a missing agent. Players explore environments while solving puzzles, collecting resources, and crafting objects (e.g., weapons, tools). Players use blasters, torpedo guns, and machine guns to kill alien creatures or human adversaries/soldiers. Gunfights can be fast paced, as multiple figures exchange gunfire, dissolving when killed. Squid-like enemies explode into purple liquid and severed tentacle limbs; players can then use squid parts to craft certain tools (e.g. inserting organic squid parts into a processor to make rope). Egg-like spider aliens also burst into yellow-splatter effects when killed."
Alan Wake 2 Deluxe Edition,"Windows PC, PlayStation 5, Xbox Series",M,"Blood and Gore,Intense Violence,Nudity,Strong Language",No Interactive Elements,"This is a survival-horror game in which players assume the roles of an FBI agent working murder cases and a writer trapped in a nightmare reality. From a third-person perspective, players explore open-world environments, interact with characters, solve puzzles, and battle humans and supernatural creatures. Players use various light sources (e.g., flashlights, flares, flashbangs) to weaken enemies, and use pistols and shotguns to kill them. Combat is highlighted by realistic gunfire, explosions, and blood-splatter effects; shooting enemies sometimes results in exposed entrails and large wounds. Cutscenes also depict instances of violence/blood: a character stabbed multiple times; a bloody, nude character dragged and tied to a table; a character''s chest cut open and heart removed; live-action footage of characters shot in the head at close range. During the course of the game, one male character is depicted nude, with exposed genitalia and buttocks. The words “f**k” and “sh*t” appear in the game."
New World: Aeternum,Windows PC,T,"Alcohol Reference,Blood,Mild Language,Violence",Users Interact (PC)In-Game Purchases (PC),"This is a massively multiplayer online (MMO) role-playing game in which players assume the role of a 17th-century settler in a new land. From a third-person perspective, players explore an open-world environment, gather resources, build shelters, and create weapons to survive. Players use spears, bows, and swords to kill humans and fantasy creatures (e.g., ghosts, skeletons, zombies) in melee-style combat. Large blood-splatter effects occur as characters attack enemies; cries of pain and impact sounds accompany the frenetic combat. The game includes numerous references to alcohol (e.g., wine, mead, sake); a handful of missions prompt players to fetch alcohol products (e.g., ""Collect Bottles of Old World Wine""). The word “bastard” appears in the game."
Sker Ritual,"PlayStation 5, Xbox Series",M,"Blood and Gore,Violence","In-Game Purchases (Xbox Series,PlayStation 5)","This is a first-person shooter in which players assume the role of a man attempting to survive a zombie onslaught during the 1910s. Players explore an island environment, complete objectives, solve puzzles, and battle zombie-like creatures in frenetic combat. Players use machine guns, rifles, crossbows, and melee weapons to kill hordes of zombies. Battles are accompanied by realistic gunfire, large explosions, and large blood-splatter effects. Some attacks can result in the decapitation of enemies. One sequence depicts viscera and entrails in a room full of corpses; another sequence requires players to collect severed heads in order to unlock a door."
Monster Hunter Stories,"Windows PC, Nintendo Switch",E10+,"Crude Humor,Fantasy Violence,Mild Language","Users Interact (PC,Switch)","This is an adventure role-playing game in which players assume the role of a monster rider on a quest to save a village from an evil force. From a third-person perspective, players explore a fantasy world, complete quests, interact with characters, and battle humans and fantastical creatures (e.g., dragons, dinosaurs, giant insects). Players can select various weapon attacks (e.g., sword slashes, club attacks) and monster attacks (e.g., speed attacks, flame breath) from a menu to defeat enemies in turn-based combat. Battles are accompanied by explosions, colorful light effects, and impact sounds. During the course of the game, players can encounter a creature that uses a Foul Gas move to emit a brown flatulence attack; one scene depicts a character eating dumplings, alluded to be made of feces (“Are those…balls of Steamed Moss?”; “[Y]ou mean Hot Spring Dumplings are actually…”; “Ewwwww!”). The phrase “helluva” appears in the game."
Construction Simulator 4,Nintendo Switch,E,No Descriptors,Users Interact (Switch),This is a simulation game in which players complete construction missions while using real-world machines and equipment. Players can run their own construction company and expand their fleet by completing jobs and upgrading contracts.
Fashion Police Squad,"PlayStation 4, PlayStation 5",T,"Fantasy Violence,Sexual Themes",No Interactive Elements,No Rating Summary
TY the Tasmanian Tiger™ 4: Bush Rescue Returns™,Nintendo Switch,E10+,Fantasy Violence,No Interactive Elements,"This is an action platformer in which players assume the role of an animal protagonist (Ty) performing various tasks for Australian Outback locals. From a 2D side-scrolling perspective, players traverse environments, collect items/hidden treasure, avoid hazards/obstacles, and use boomerangs to defeat enemies (e.g., lizards, birds, giant insects). Enemies use cartoony weapons (e.g., mines, flamethrowers, missiles, over-sized guns) to attack Ty. Combat is highlighted by flame-like effects/explosions, impact sounds, and cries of pain. Some game modes prompt players to defeat hordes of enemies in fast-paced combat."
SunnySide,PlayStation 5,T,"Fantasy Violence,Language,Mild Suggestive Themes,Use of Alcohol and Tobacco",No Interactive Elements,"This is a role-playing simulation game in which players build a new life in the Japanese countryside. Players can build a homestead, cultivate resources/products, and establish relationships with various locals. Some expeditions trigger turn-based fights with impish creatures; players take turns using small projectiles or elemental attacks (e.g., bursts of flame, flares, ice attacks) to deplete opponents'' health bars. The game allows players to form romantic relationships with other characters (e.g., dates, outings); the dialogue can be somewhat suggestive (e.g., “I want dramatic, sexy adventures...I want unreasonable displays of affection”; “...[S]ince we''re both super hot…maybe we can go back to your place after this.” During the course of the game, players'' character can combine ingredients to brew beer and can sell it to local establishments; players'' character can also purchase and consume beer, wine, and cocktails. One character is often depicted with a cigarette in his mouth. The words “sh*t” and “a*shole” appear in the game."
The Smurfs - Village Party,"PlayStation 5, Nintendo Switch",E,Mild Fantasy Violence,No Interactive Elements,"This is an adventure party game in which players assume the role of a Smurf helping Papa Smurf throw a party. Players engage in various mini-games (e.g., collecting presents, stacking dishes), a handful of which may depict mild violence: characters shoving or using sticks to hit opponents--damage is indicated by stun effects and “dizzy stars.” Other mini-games require players to defeat a boss character by using crossbows and/or slingshots with targeting crosshairs."
RKGK / Rakugaki,Windows PC,T,"Fantasy Violence,Mild Language",No Interactive Elements,"This is an adventure platformer in which players assume the role of a graffiti artist trying to save a city from an evil corporation''s control. From a third-person perspective, players run and jump around the city while using paint/art to light up environments and save citizens. Players can dispatch robot enemies or turrets by using dash attacks. During boss battles, players must evade projectiles, explosions, and lasers; bosses are defeated via players'' spray-painting attacks. The words “pr*ck” and “a*s” appear in the game."
Hidden Objects 6: Shopping Clutter,"PlayStation 5, Nintendo Switch",E,"Alcohol Reference,Mild Blood",No Interactive Elements,"This is a collection of hidden-object puzzle games set in the fictional town of Animalville. Players complete slide puzzles and matching challenges while helping an animal family through story chapters. Some scenes contain Halloween or Dracula-themed imagery, including bloodstained goblets and/or knives. A handful of scenes depict frothy mugs of beer, among dozens of other objects and items."
Fatal Run,ATARI 7800,E,Mild Fantasy Violence,No Interactive Elements,"This is an arcade-style racing game in which players race along a variety of tracks. During races, players can use various pixelated weapons (e.g., machine guns, missiles) against other racers. Cars briefly explode when struck."
Senua’s Saga: Hellblade II,"Windows PC, Xbox Series",M,"Blood and Gore,Intense Violence,Strong Language",No Interactive Elements,"This is an adventure game in which players assume the role of Senua, a Pict warrior trying to save her people from Viking oppressors. From a third-person perspective, players explore Icelandic villages/vistas while battling various enemies (e.g., Vikings, ghouls, cultists). Players use swords to slash at enemies in frenetic melee combat, which is highlighted by blood-splatter effects, cries of pain, and impalement finishing moves. Impaling deaths are often depicted; one distant scene depicts a villain cutting off a man''s arm. Cutscenes depict occasional decapitation and/or dismemberment, and some environments contain bloodied, decaying corpses and severed limbs. The word “f**k” appears in the game."
Undisputed,"PlayStation 5, Xbox Series",T,"Blood,Lyrics,Violence","In-Game Purchases (Xbox Series,PlayStation 5)","This is a boxing simulation game in which players can create a character to participate in realistic bouts as they progress through a career track. Fighters punch each other repeatedly, attempting to knock each other out; knockout punches are replayed from several angles in slow-motion. Repeated punches sometimes result in cuts on boxers'' faces, with blood dripping effects; blood also sprays briefly when boxers are hit particularly hard/knocked out. Accompanying song lyrics occasionally contain the word “sh*t.”"
SAMURAI WARRIORS 4 DX,Windows PC,T,"Mild Suggestive Themes,Use of Alcohol and Tobacco,Violence",Users Interact (PC),"This is an action game in which players assume the roles of various Japanese historical figures in dramatic retellings of Japanese history. From a third-person perspective, players use swords, spears, hammers, rifles, and magic to kill hordes of enemy soldiers and generals in melee-style combat. Battles are frenetic, highlighted by impact sounds, cries of pain, occasional slow-motion effects, and colorful light effects. Cutscenes also contain direct and indirect depictions of violence: characters sword fighting; bodies littering the ground after battle. Some female characters are designed with revealing outfits (e.g., deep cleavage, bikinis in the battlefield) and/or breast-jiggling effects. During the course of the game, wine and celebratory drinks are referenced in the dialogue (e.g., “Munenori happily drank the wine down”; “I can hold my drink, so you''ve got a long night ahead!”); a handful of sequences depict characters drinking alcohol. Another sequence depicts a man smoking a pipe."
Supernatural,Meta Quest,T,Lyrics,Users Interact (Meta Quest),"This is a VR health and fitness app in which players engage in full body workouts. Players can engage in four modes of activity (Box, Flow, Meditate, Stretch) while guided by personal coaches. In the Box and Flow activities, players must match the tempo and direction of icons as they appear in time with the music. Some song lyrics contain references to suggestive material (e.g., “I like mornin'' sex”; “Wet and gushy, make that p*llout game weak”; “Somebody come get her, she''s dancin'' like a stripper”; “E*t me and record it, but your edge-up all I''m showing”; “Man, I swear I love her how she work that damn pole”). A handful of songs allude to drugs (e.g., “I''m a pothead, true enough”; “And I get high with my baby”; “At 56 a gram, 5 a hundred grams”)."
Grounded: Fully Yoked Edition,"PlayStation 5, Nintendo Switch, Xbox One, Xbox Series",T,"Blood,Mild Language,Violence","Users Interact (Xbox One,Switch,Xbox Series,PlayStation 5)","This is a survival-adventure game in which players control ant-sized humans in backyard environments. From first- and third-person perspectives, players search for resources, craft weapons, build shelters, and battle realistic, over-sized insects. Combat can be frenetic at times, with players using swords, clubs, and spears to attack insects that slash, bite, and spit at players. Human characters emit small splashes of blood when injured; insects emit splatters of green or yellow blood when killed. Players can also encounter a room full of decapitated and impaled ant heads, with green blood splatter on the ground. The words “p*ss off” appear in the text."
Super Monkey Ball Banana Rumble,Nintendo Switch,E,Mild Fantasy Violence,In-Game Purchases (Switch),"This is an action platformer in which players control a monkey inside a ball on a quest to find a legendary banana. Players roll through stages, avoid traps, collect bananas, and occasionally engage in multiplayer matches (e.g., Battle mode). Throughout the game, players can use various power ups (e.g., rockets, ice blasts, baseball bats) against characters (e.g., robots); some characters yelp out when hit and fly through the air from explosions. In Battle mode, players can use a cartoony missile to knock other players away."
Tales of Kenzera™: ZAU,"Windows PC, PlayStation 5, Nintendo Switch, Xbox Series",E10+,Fantasy Violence,No Interactive Elements,"This is an adventure platformer in which players assume the role of a shaman dealing with the grief of his father''s death. From a side-scrolling perspective, players navigate mazes of levels, solve puzzles, and battle fantastical enemies (e.g., corrupted spirits, Adze) in melee-style combat. Players use spears and cosmic powers from the Sun and Moon to attack enemies. Battles are highlighted by colorful light effects, impact sounds, and dwindling health bars. Boss battles contain more protracted combat."
Kena: Bridge of Spirits - Deluxe Edition,"Xbox One, Xbox Series",T,Fantasy Violence,No Interactive Elements,"This is an action-adventure game in which players control a spirit guide (Kena) as she removes corruption and restores various environments. From a third-person perspective, players traverse platforms, solve puzzles, interact with spirits and creatures, and battle corrupted spirits and boss creatures. Players use a magic staff, arrows, and small creatures (called Rot) to strike enemies and drain their health meters in melee-style combat. Enemies (e.g., human-like spirits, tree-like ghouls, giant wood creatures) attack players by using bladed weapons and explosive bursts of fire/energy. Combat can be frenetic, with frequent impact sounds, screen-shaking effects, and cries of pain."
Xuan-Yuan Sword: Mists Beyond the Mountains,Nintendo Switch,T,"Blood,Fantasy Violence,Mild Language,Sexual Themes,Use of Alcohol",No Interactive Elements,No Rating Summary
ONE PIECE ODYSSEY Deluxe Edition,Nintendo Switch,T,"Mild Language,Suggestive Themes,Use of Tobacco,Violence",In-Game Purchases (Switch),"This is an action-adventure game in which players follow the story of shipwrecked characters from the One Piece comic and animated series. As players explore a mysterious island, they engage in turn-based battles with enemy pirates/thugs and occasional large creatures. Players choose attack moves/skills from a menu before watching short animations of characters punching/kicking, using swords or pistols, or throwing fireballs/bursts of energy. Characters cry out in pain when injured, and damage is indicated by dwindling health meters/hit points. Cutscenes contain more dramatic instances of violence: characters using fire attacks on each other, as one appears to get killed; a man shooting a pistol at a young character at close range. The game contains some suggestive material: female characters designed with revealing outfits (e.g., low-cut tops, deep cleavage); close-up camera views of characters'' chests; text/dialogue such as ""The golden ration of exposed buttock"" and “Their long exposure to humans has given them a perverted response to naked women.” One recurring character named Smoker is depicted with two cigars in his mouth. The word “bastard” appears in the game."
Star Wars Outlaws,"Windows PC, PlayStation 5, Xbox Series",T,"Mild Language,Simulated Gambling,Violence","Users Interact (PC,Xbox Series,PlayStation 5)In-Game Purchases (PC,Xbox Series,PlayStation 5)","This is third-person action-adventure game in which players assume the role of an outlaw navigating the underworld of the Star Wars universe. As players explore open-world environments, they can accept missions/jobs for various criminal factions. Most missions involve using stealth to sneak through heavily guarded compounds or shooting through waves of hostile enemies. Players use a variety of gadgets and blaster-type weapons during missions. Players can perform dramatic punching takedowns when using stealth or close-quarter combat. Fighting is highlighted by futuristic gunfire, explosions, and cries of pain. During the course of the game, players can wager in-game currency on Sabacc, a blackjack-like card game with detailed rules; one area allows players to wager on fantasy races in order to further a plot point. The word “bastard” appears in the game."
Fitness Boxing feat. HATSUNE MIKU,Nintendo Switch,E,No Descriptors,No Interactive Elements,"This is a fitness/rhythm-based game in which players perform boxing routines by following timed prompts along with music. Players earn points by matching Hatsune Miku and her friends'' various on -screen movements (e.g., jabs, uppercuts, dodges)."
Fallout 4,"Windows PC, PlayStation 4, PlayStation 5, Xbox One, Xbox Series",M,"Blood and Gore,Intense Violence,Strong Language,Use of Drugs","In-Game Purchases (PC,PlayStation 4,Xbox One,Xbox Series,PlayStation 5)","This is a role-playing game in which players assume the role of a fallout shelter resident attempting to survive in a post-apocalyptic world. From first- or third-person perspectives, players explore an open-world environment, collect and craft items/weapons, complete missions, and battle various enemies (e.g., mutated creatures, human survivors). Players use pistols, shotguns, rifles, machine guns, and explosives to kill enemies in ranged combat; players can also use bats, pipes, blades, and brass knuckles to defeat enemies in melee-style combat. Battles are frenetic, accompanied by realistic gunfire, explosions, cries of pain, and large blood-splatter effects. Some weapons/attacks result in slow-motion dismemberment and/or decapitation; other weapons result in enemies being blown apart into scattered limbs and chunks of flesh. During the course of the game, players can consume a variety of fictional drugs (e.g., Buffout, Jet, Psycho) through the use of a menu; repeated use of these drugs leads to an addiction status and various negative effects. The words “f**k,” “sh*t,” and “a*shole” are heard in the dialogue."
Autobahn Police Simulator 2,Nintendo Switch,T,"Drug Reference,Mild Violence,Use of Alcohol",No Interactive Elements,No Rating Summary
Disney Epic Mickey: Rebrushed,"Windows PC, PlayStation 4, PlayStation 5, Nintendo Switch, Xbox One, Xbox Series",E10+,Fantasy Violence,No Interactive Elements,"This is an adventure game in which players assume the role of Mickey Mouse as he attempts to stop villains from destroying a magical world. From a third-person perspective, players explore twisted versions of Disney attractions (e.g., Neverland, Haunted Mansion) that have been overrun by enemies (e.g., ink blobs, animatronic characters). Players use a magic paintbrush to battle enemies, spraying projectile paint/thinner to make them friendly or melt away. Players can also hop on enemies'' heads and/or perform spin attacks, stunning and knocking creatures back. Combat is often frenetic, accompanied by cries of pain and impact sound effects. Some cutscenes contain tonally dark moments: a character abducted into a mirror; a character restrained, while threatened with a drill and chainsaw."
Crossfire Sierra Squad,PlayStation 5,M,"Blood,Strong Language,Violence",No Interactive Elements,"This is a first-person shooter in which players assume the role of the leader of an elite fireteam in the middle of a war. Players engage in combat missions, using shotguns, sniper rifles, machine guns, and grenades to kill enemy soldiers and drones. Combat is frenetic, highlighted by realistic gunfire, cries of pain, and blood-splatter effects. One sequence depicts a dying soldier with blood staining the walls and ground around him. The word “f**k” appears in the game."
Gravity Circuit,"PlayStation 5, Nintendo Switch",E10+,Fantasy Violence,No Interactive Elements,No Rating Summary
